Purchase__basketValueGross,Purchase__purchaseType,Purchase__overallBasketSavings,Purchase__storeId,Purchase__paymentType__category,Purchase__paymentType__amount,Purchase__timeStamp,Purchase__basketValueNet,Purchase__says,Purchase__storeName,Purchase__storeFormat,Purchase__product__name,Purchase__product__quantity,Purchase__product__channel,Purchase__product__price
,,,,,,,,,,,Tesco German Salami 135G,1,IN_STORE,1
24.61,IN_STORE,0.85,3189,NA,23.76,42:17.6,23.76,NA,SOUTHWARK,SuperStore,Tesco Sliced Red Onion 180G,1,IN_STORE,0.75
,,,,,,,,,,,Sharwoods Real Oyster Sauce 150Ml,1,IN_STORE,2
,,,,,,,,,,,Deli Kitchen 4 Greek Style Flatbreads 320G,1,IN_STORE,1.35
,,,,,,,,,,,Big & Free Large White Free Range Eggs 10 Pack,1,IN_STORE,2
,,,,,,,,,,,Jaffa Clementine Or Sweet Easy Peeler 600G,1,IN_STORE,2
,,,,,,,,,,,Tesco Hand Shelled Peas 160G,1,IN_STORE,1.25
,,,,,,,,,,,Tesco Grated Parmigiano Reggiano 100G,1,IN_STORE,2.2
,,,,,,,,,,,Tesco Glace Cherry Halves 200G,1,IN_STORE,1.5
,,,,,,,,,,,The Big Prawn Co Big & Juicy Crayfish 120G,1,IN_STORE,3.9
,,,,,,,,,,,Tesco Cranberry & Raspberry Juice 1 Litre,1,IN_STORE,1.25
,,,,,,,,,,,Tesco Italian Mixed Peel 200G,1,IN_STORE,0.8
,,,,,,,,,,,Tesco Finest Dry Cure Bacon Lardons 180G,1,IN_STORE,2.5
,,,,,,,,,,,Warburtons Toastie Sliced White Bread 400G,1,IN_STORE,0.85
,,,,,,,,,,,Yutaka Soba Noodles 250G,1,IN_STORE,1.3
,,,,,,,,,,,Nightingale Farms Cherry Tomatoes 250G,2,IN_STORE,0.48
46.37,IN_STORE,7.07,3189,NA,39.3,07:17.2,39.3,NA,SOUTHWARK,SuperStore,Mccain Quick Cook French Fries 750G,1,IN_STORE,2.5
,,,,,,,,,,,Tesco Bunched Spring Onions 100G,1,IN_STORE,0.37
,,,,,,,,,,,Tesco Smoked Salmon Slices 180G,1,IN_STORE,5
,,,,,,,,,,,Nightingale Farms Baby Plum Tomatoes 250G,1,IN_STORE,0.65
,,,,,,,,,,,Highland Spring Sparkling Water 6 X 1L,1,IN_STORE,3
,,,,,,,,,,,Tesco Finest Mixed Baby Tomatoes 250G,1,IN_STORE,1.5
,,,,,,,,,,,La Doria Sweetcorn In Water 198G,1,IN_STORE,0.6
,,,,,,,,,,,Jaffa Clementine Or Sweet Easy Peeler 600G,1,IN_STORE,2
,,,,,,,,,,,Tesco 250G Plus 20% Extra Free,1,IN_STORE,3
,,,,,,,,,,,Gressingham Duck Fillets 250G,1,IN_STORE,4
,,,,,,,,,,,Tesco Twin Garlic Reduced Fat Baguettes 430G,1,IN_STORE,1.6
,,,,,,,,,,,Gressingham Duck Legs 462G,1,IN_STORE,4
,,,,,,,,,,,Gem Avocado Twin Pack Xl,2,IN_STORE,2.5
,,,,,,,,,,,De Cecco Spaghetti 500G,1,IN_STORE,1.55
,,,,,,,,,,,Itsu Miso'easy Traditional Miso 5X21g,1,IN_STORE,2
,,,,,,,,,,,Tesco Finest King Oyster Mushrooms 150G,1,IN_STORE,1.6
,,,,,,,,,,,President Unsalted Butter 250G,1,IN_STORE,2
,,,,,,,,,,,Tesco Nocellara Del Belice Olives 160G,2,IN_STORE,2.5
,,,,,,,,,,,Tesco Sussex Romaine Lettuce Hearts 2 Pack,1,IN_STORE,1
27.82,IN_STORE,5.2,3189,NA,22.62,21:42.4,22.62,NA,SOUTHWARK,SuperStore,Napolina Passata 500G,2,IN_STORE,0.6
,,,,,,,,,,,Tesco Bunched Spring Onions 100G,1,IN_STORE,0.37
,,,,,,,,,,,Gem Avocado Twin Pack Xl,2,IN_STORE,2.5
,,,,,,,,,,,Tesco Smoked Salmon Slices 180G,2,IN_STORE,5
,,,,,,,,,,,Nightingale Farms Baby Plum Tomatoes 250G,1,IN_STORE,0.65
,,,,,,,,,,,Tesco Finest Jumbo Cooked King Prawns 225G,1,IN_STORE,4.5
,,,,,,,,,,,Tesco E/Anglian Sweet Baby Romaine 2 Pack,1,IN_STORE,1
,,,,,,,,,,,Tesco Pure Sunflower Oil 1L,1,IN_STORE,1.1
,,,,,,,,,,,Gressingham Duck Fillets 250G,1,IN_STORE,4
10.15,IN_STORE,0.41,3189,NA,9.74,21:27.9,9.74,NA,SOUTHWARK,SuperStore,Tesco Sugar Snap Peas 150G,1,IN_STORE,1
,,,,,,,,,,,Tesco Turkey Drumstick 700-900G,1,IN_STORE,2.49
,,,,,,,,,,,Tesco Cucumber Whole Each,1,IN_STORE,0.43
,,,,,,,,,,,Cadbury Mini Eggs Carton 38.3G,1,IN_STORE,0.5
,,,,,,,,,,,Tesco Finest King Oyster Mushrooms 200G,1,IN_STORE,1.75
,,,,,,,,,,,Tesco Pork Shoulder Steaks 700G,1,IN_STORE,3.5
,,,,,,,,,,,Nightingale Farms Cherry Tomatoes 250G,1,IN_STORE,0.48
14.59,IN_STORE,5.69,3189,NA,8.9,57:32.7,8.9,NA,SOUTHWARK,SuperStore,Tesco Garlic Flatbread 255G,1,IN_STORE,2
,,,,,,,,,,,Tesco Smoked Salmon Slices 180G,1,IN_STORE,5
,,,,,,,,,,,Mcvitie's Dark Chocolate Digestives 433G,1,IN_STORE,1.89
,,,,,,,,,,,Tesco Clementine Or Sweet Easy Peeler Pack 600G,1,IN_STORE,1.35
,,,,,,,,,,,Tesco Oaty Rounds Biscuits 300G,1,IN_STORE,0.45
,,,,,,,,,,,Kraft Philadelphia Cheese 200 G Tub,2,IN_STORE,1.95
23.34,IN_STORE,6.39,3189,NA,16.95,50:31.1,16.95,NA,SOUTHWARK,SuperStore,Tesco Garlic Baguette 205G,1,IN_STORE,0.9
,,,,,,,,,,,Elmlea Double Cream Alternative 284Ml,1,IN_STORE,0.89
...truncated.,,,,,,,,,,,,,,
