Purchase__basketValueGross,Purchase__purchaseType,Purchase__overallBasketSavings,Purchase__storeId,Purchase__paymentType__category,Purchase__paymentType__amount,Purchase__timeStamp,Purchase__basketValueNet,Purchase__says,Purchase__storeName,Purchase__storeFormat,Purchase__product__name,Purchase__product__quantity,Purchase__product__channel,Purchase__product__price
79.03,IN_STORE,3.17,3189,NA,75.86,37:36.8,75.86,NA,SOUTHWARK,SuperStore,Koko Dairy Free Unsweetened Alternative Longlife D...,5,IN_STORE,1.5
,,,,,,,,,,,Tesco Bunched Spring Onions 100G,1,IN_STORE,0.37
,,,,,,,,,,,Tesco Finest Cheesecake Passion Fruit & Raspberry ...,1,IN_STORE,4
,,,,,,,,,,,Tesco Mixed Sized Organic Eggs 6 Pack,1,IN_STORE,1.8
,,,,,,,,,,,Vanish Pet Expert Carpet Care Foam 600Ml,1,IN_STORE,6
,,,,,,,,,,,Tesco Capers 190G,1,IN_STORE,1.8
,,,,,,,,,,,Tesco Watermelon Each,1,IN_STORE,2.5
,,,,,,,,,,,Tesco Sweet & Crunchy Salad 250G,1,IN_STORE,0.59
,,,,,,,,,,,Gressingham Duck Fillets 250G,2,IN_STORE,4.25
,,,,,,,,,,,Tesco Finest Oyster Mushroom Cluster 150G,1,IN_STORE,1.12
,,,,,,,,,,,Highland Spring Sparkling Water 6 X 1L,4,IN_STORE,3
,,,,,,,,,,,Tesco Apothecary Large Scented Candle - Neroli and...,1,IN_STORE,8
,,,,,,,,,,,Finest Echalion Shallots 400G,1,IN_STORE,0.9
,,,,,,,,,,,Tesco Radish Pack 240G,1,IN_STORE,0.43
,,,,,,,,,,,Tesco Carrots 1Kg,1,IN_STORE,0.4
,,,,,,,,,,,Tesco Twin Garlic Baguette 410G,1,IN_STORE,1.6
,,,,,,,,,,,Tesco Finest Green Grapes Seedless 400G,1,IN_STORE,1.5
,,,,,,,,,,,Kikkoman Soy Sauce 150Ml,1,IN_STORE,2
,,,,,,,,,,,T.Kent Baby Plum Tomatoes 325G,1,IN_STORE,1
,,,,,,,,,,,Tesco Pork Ribs 700G,1,IN_STORE,4.2
,,,,,,,,,,,Good Boy Wagtastic Cuddle Friends,1,IN_STORE,5
,,,,,,,,,,,Tesco White Cabbage,1,IN_STORE,0.45
,,,,,,,,,,,Tesco Choi Sum 200G,1,IN_STORE,1.2
,,,,,,,,,,,Califia Farms Oat Barista Blend 1Ltr,2,IN_STORE,1.5
18.1,IN_STORE,1,3189,NA,17.1,00:03.3,17.1,NA,SOUTHWARK,SuperStore,Little Moons Chocolate & Hazelnut Ice Cream Mochi ...,1,IN_STORE,4.5
,,,,,,,,,,,Tesco Finest Oyster Mushroom Cluster 150G,1,IN_STORE,1.5
,,,,,,,,,,,Thorntons Pearls Hazelnut Chocolate 167G,1,IN_STORE,3.5
,,,,,,,,,,,Tesco Beef Rump Steak 255G,2,IN_STORE,3.8
61.96,IN_STORE,0.3,3189,NA,61.66,56:42.0,61.66,NA,SOUTHWARK,SuperStore,Tesco Sirloin Steak 227G,1,IN_STORE,3.8
,,,,,,,,,,,Bahlsen Baileys Choco Leibniz Biscuits 135G,1,IN_STORE,1.49
,,,,,,,,,,,Tesco Watermelon Wedges 550G,2,IN_STORE,2.5
,,,,,,,,,,,Nivea Men Black & White Power Antiperspirant Deodo...,1,IN_STORE,1.6
,,,,,,,,,,,Nivea Men Black & White Power Antiperspirant Deodo...,1,IN_STORE,0.95
,,,,,,,,,,,Swizzels Lolly Mix Bag 365G,2,IN_STORE,2
,,,,,,,,,,,Tesco Aubergine Each,1,IN_STORE,0.69
,,,,,,,,,,,Tesco Finest Black Forest Gateaux Shortbread 160G,1,IN_STORE,3
,,,,,,,,,,,Galaxy Salted Caramel 135G,3,IN_STORE,0.99
,,,,,,,,,,,Klc Creepy Pumpkins Solid Milk Chocolate 75G,2,IN_STORE,1
,,,,,,,,,,,Nivea For Men Dry Antiperspirant Deodorant 250Ml,2,IN_STORE,1.6
,,,,,,,,,,,Cadbury Chunk Advent Calendar 258G,1,IN_STORE,5
,,,,,,,,,,,Galaxy Caramel Chocolate Bar 135G,3,IN_STORE,0.99
,,,,,,,,,,,Cadbury Roses Tub 600G,1,IN_STORE,4
,,,,,,,,,,,Cadbury Dairy Milk Caramel Chocolate Bar 120G,3,IN_STORE,0.98
,,,,,,,,,,,Cadbury Heroes Tub 600G,1,IN_STORE,4
,,,,,,,,,,,Tesco Finest Irish Cream Florentines 105G,1,IN_STORE,2.5
,,,,,,,,,,,Tesco Organic Tenderstem Broccoli 200G,1,IN_STORE,2.5
,,,,,,,,,,,Cadbury Pop Up Advent Calendar 267G,1,IN_STORE,5
,,,,,,,,,,,Tesco Natural Sweet Sweetcorn In Water 200G,3,IN_STORE,0.45
,,,,,,,,,,,Jaffa Candy Floss Grapes 800G,1,IN_STORE,3
24.28,IN_STORE,0.79,3189,NA,23.49,39:11.1,23.49,NA,SOUTHWARK,SuperStore,Tesco Mixed Sized Organic Eggs 6 Pack,1,IN_STORE,1.8
,,,,,,,,,,,Tesco Organic Baby Potatoes 750G,1,IN_STORE,1.1
,,,,,,,,,,,Mowi 4 Smoked Scottish Salmon Slices 100G,1,IN_STORE,5
,,,,,,,,,,,Highland Spring Sparkling Water 6 X 1L,1,IN_STORE,3
,,,,,,,,,,,Finest Echalion Shallots 400G,1,IN_STORE,1.2
,,,,,,,,,,,Twinings Rooibos & Honey 20 Teabags 36G,1,IN_STORE,2.5
,,,,,,,,,,,Tesco Bananas Loose,1,IN_STORE,0.73
,,,,,,,,,,,Tesco Aubergine Each,1,IN_STORE,0.69
,,,,,,,,,,,Tesco Lemon & Ginger 40S 80G,1,IN_STORE,1.2
,,,,,,,,,,,Tesco Carrots 1Kg,1,IN_STORE,0.4
,,,,,,,,,,,Tesco British Chicken Thighs 1Kg,1,IN_STORE,2
,,,,,,,,,,,Tesco Orange Minimum 5 Pack,1,IN_STORE,1.5
,,,,,,,,,,,Twinings Strawberry & Raspberry 40G,1,IN_STORE,1.7
,,,,,,,,,,,Twining's Cherry & Cinnamon Tea Bags 20'S 40G,1,IN_STORE,1.7
21.45,IN_STORE,2.76,3189,NA,18.45,00:09.9,18.45,NA,SOUTHWARK,SuperStore,Tesco Bunched Spring Onions 100G,1,IN_STORE,0.37
,,,,,,,,,,,Tesco White Seedless Grapes 400G Plus 25% Extra,1,IN_STORE,2
,,,,,,,,,,,Koko Dairy Free Unsweetened Alternative Longlife D...,1,IN_STORE,1.5
,,,,,,,,,,,Falfish Cornish Butterfly Sardine Fillets 180G,1,IN_STORE,2.4
,,,,,,,,,,,Fresh & Naked Just Wild Rocket 60G,1,IN_STORE,0.85
,,,,,,,,,,,Total Greek Strained Yogurt 500G,1,IN_STORE,2.75
,,,,,,,,,,,Haribo Tangfastics 175G,1,IN_STORE,0.79
,,,,,,,,,,,Tesco Finest 2 Eton Mess Pots 200G,1,IN_STORE,3
,,,,,,,,,,,Tesco Finest White Sourdough Loaf 400G,1,IN_STORE,1.5
,,,,,,,,,,,Alpro Coconut No Sugars Long Life Drink 1 Litre,1,IN_STORE,1.7
,,,,,,,,,,,Tesco Universal Bag For Life,1,IN_STORE,0.2
,,,,,,,,,,,Tesco Finest King Oyster Mushrooms 150G,1,IN_STORE,1.6
,,,,,,,,,,,Tesco Sweet & Crunchy Salad 250G,1,IN_STORE,0.79
,,,,,,,,,,,Linda Mccartney Organic Barista Coconut Drink 1L,1,IN_STORE,2
64.32,IN_STORE,10.55,3189,NA,53.77,40:04.8,53.77,NA,SOUTHWARK,SuperStore,Mancave Caffeine Shampoo 200Ml,1,IN_STORE,5.5
,,,,,,,,,,,Tesco Bunched Spring Onions 100G,1,IN_STORE,0.37
,,,,,,,,,,,Tesco Large Chicken Fillet Pack 1.6Kg,1,IN_STORE,8.45
,,,,,,,,,,,Method Wood Floor Cleaner 739Ml,2,IN_STORE,4
,,,,,,,,,,,Gressingham Duck Fillets 250G,2,IN_STORE,4.25
,,,,,,,,,,,Buxton Sparkling 6X1litre,1,IN_STORE,3
,,,,,,,,,,,Tesco Twin Garlic Baguette 410G,1,IN_STORE,1.6
,,,,,,,,,,,Glade Aromatherapy Candle Calm Mind 260G,1,IN_STORE,9
,,,,,,,,,,,Nivea For Men Dry Antiperspirant Deodorant 250Ml,1,IN_STORE,1.6
,,,,,,,,,,,Princes Drained Tuna Chunk In Brine 110G,3,IN_STORE,1.5
,,,,,,,,,,,T.Kent Baby Plum Tomatoes 325G,1,IN_STORE,1
,,,,,,,,,,,Tesco Ironing Water Spring Fresh 1Lt,3,IN_STORE,0.8
,,,,,,,,,,,Tesco Finest King Oyster Mushrooms 150G,1,IN_STORE,1.6
,,,,,,,,,,,Tesco Beef Rump Steak 255G,1,IN_STORE,3.8
,,,,,,,,,,,Good Boy Wagtastic Cuddle Friends,1,IN_STORE,5
38,IN_STORE,NA,3720,NA,38,16:17.9,38,NA,SOUTHWARK PFS,Petrol,UNLEADED,1,IN_STORE,1.33
1.6,IN_STORE,NA,3189,NA,1.6,24:51.2,1.6,NA,SOUTHWARK,SuperStore,Tesco Finest King Oyster Mushrooms 150G,1,IN_STORE,1.6
25.73,IN_STORE,5,3189,NA,20.73,24:12.6,20.73,NA,SOUTHWARK,SuperStore,Off The Eaten Path Pea & Bean Stick Sea Salt 100G,1,IN_STORE,2.25
,,,,,,,,,,,Tesco Watermelon Wedges 550G,1,IN_STORE,2.5
,,,,,,,,,,,Botanica Airwick Vanilla & Himalayan Magnolia 205G,1,IN_STORE,7
,,,,,,,,,,,Willow Farm Chicken Thighs 900G - 1.2Kg,1,IN_STORE,1.73
,,,,,,,,,,,Off The Eaten Path Black Pepper Pea & Bean Stick 1...,1,IN_STORE,2.25
,,,,,,,,,,,Tesco Pork Ribs 700G,1,IN_STORE,4.2
,,,,,,,,,,,Good Boy Wagtastic Cuddle Friends,1,IN_STORE,5
,,,,,,,,,,,Tesco Ironing Water Spring Fresh 1Lt,1,IN_STORE,0.8
42.25,IN_STORE,NA,2453,NA,42.25,05:37.8,42.25,NA,EDINBURGH,SuperStore,Malcolm Allan Steak Lorne Sausage 260G,1,IN_STORE,2
,,,,,,,,,,,Tesco Watermelon Wedges 550G,1,IN_STORE,2.5
,,,,,,,,,,,Tesco Red Organic Onions 535G,1,IN_STORE,1.25
,,,,,,,,,,,Grahams Skyr Passion Fruit Mango & Papaya 450G,1,IN_STORE,0.99
,,,,,,,,,,,Tesco Balsamic Vinegar Of Modena 250Ml,1,IN_STORE,1
,,,,,,,,,,,Bells Puff Pastry 212G,1,IN_STORE,0.73
,,,,,,,,,,,Mackies Haggis & Cracked Black Pepper Crisps 150G,2,IN_STORE,0.99
,,,,,,,,,,,Tesco British Chicken Thigh Fillets 1Kg,1,IN_STORE,5
,,,,,,,,,,,Highland Spring Sparkling Water 6 X 1L,3,IN_STORE,3
,,,,,,,,,,,Galbani Italian Burrata Cheese 150G,1,IN_STORE,2.5
,,,,,,,,,,,Tesco Strawberries 400G,1,IN_STORE,2
,,,,,,,,,,,Tesco Unsmoked Lardons 200G,1,IN_STORE,2
,,,,,,,,,,,Simon Howie Beef Olives 400G,1,IN_STORE,3.5
,,,,,,,,,,,Tesco Finest Oyster Mushroom Cluster 150G,1,IN_STORE,1.5
,,,,,,,,,,,Tesco Finest Sweet Mini Peppers 220G,1,IN_STORE,1.5
,,,,,,,,,,,Tesco Finest King Oyster Mushrooms 150G,1,IN_STORE,1.6
,,,,,,,,,,,Counter Smoked Processed Cheese 200G,1,IN_STORE,2.2
,,,,,,,,,,,Tesco Wild Rocket 60G,1,IN_STORE,1
72.84,IN_STORE,3.19,4425,NA,69.65,32:23.1,69.65,NA,DUNFERMLINE FRE STAON,SuperStore,Nightingale Farms Baby Plum Tomatoes 250G,1,IN_STORE,0.65
,,,,,,,,,,,Mothers Pride Plain Medium White Bread 800G,1,IN_STORE,1.1
,,,,,,,,,,,Rosedene Farms Raspberries 125G,1,IN_STORE,1.24
,,,,,,,,,,,Tesco Radish Pack 240G,1,IN_STORE,0.43
,,,,,,,,,,,Mackie Indulgent Madagascan Vanilla 1 Litre,1,IN_STORE,3.5
,,,,,,,,,,,T.Ready To Eat Large Avocados Each,1,IN_STORE,0.85
,,,,,,,,,,,Mackies Raspberry Ripple Ice Cream 1 Litre,1,IN_STORE,3
,,,,,,,,,,,Kettle Chips Thai Sweet Chilli 150G,1,IN_STORE,1.5
,,,,,,,,,,,Tesco Luxury Soft Toilet Tissue 9 Roll White,1,IN_STORE,2.95
,,,,,,,,,,,Rosedene Farms Strawberries 227G,1,IN_STORE,1.39
,,,,,,,,,,,Nescafe Dolce Gusto Coconut Flat White Coffee Pods...,1,IN_STORE,3.5
,,,,,,,,,,,Tesco Smoked Bacon Medallions 250G,1,IN_STORE,2.25
,,,,,,,,,,,Rr Spink & Sons Hot Smoked Salmon 120G,1,IN_STORE,4
,,,,,,,,,,,Tesco Aubergine Each,1,IN_STORE,0.7
,,,,,,,,,,,Highland Game Venison Steaks Whisky Jus 325G,1,IN_STORE,6.75
,,,,,,,,,,,Kleinkaroo 2 Ostrich Fillet Steaks 250G,1,IN_STORE,5.25
,,,,,,,,,,,Tesco Baby Cucumbers 200G,2,IN_STORE,1
,,,,,,,,,,,Deli Kitchen 4 Greek Style Flatbreads 320G,1,IN_STORE,1.35
,,,,,,,,,,,Highland Spring Sparkling Water 6 X 1L,1,IN_STORE,3
,,,,,,,,,,,Tesco Ripe Bananas 5 Pack,1,IN_STORE,0.69
,,,,,,,,,,,Tesco Bunched Spring Onions 100G,2,IN_STORE,0.37
,,,,,,,,,,,Tesco Smoked Mackerel Flakes 120G,1,IN_STORE,2
,,,,,,,,,,,Happy Egg Co. Free Range Eggs 10 Mixed Weight,1,IN_STORE,2.2
,,,,,,,,,,,Tesco Carrots 1Kg,1,IN_STORE,0.4
,,,,,,,,,,,Nescafe Dolce Gusto Starbucks Espresso Roast 12 Ca...,1,IN_STORE,4
,,,,,,,,,,,Nescafe Dolce Gusto Cafe Au Lait Coffee Pods 16 Se...,1,IN_STORE,3.5
,,,,,,,,,,,The Big Prawn Co Big & Juicy Crayfish 120G,1,IN_STORE,3.9
,,,,,,,,,,,Tarbert Honey Salmon Slices 100G,1,IN_STORE,3
,,,,,,,,,,,Nescafe Dolce Gusto Americano Coffee 16 Pods 128G,2,IN_STORE,3.5
34,IN_STORE,NA,3720,NA,34,05:25.4,34,NA,SOUTHWARK PFS,Petrol,UNLEADED,1,IN_STORE,1.33
86.83,IN_STORE,10.92,3189,NA,75.91,14:52.9,75.91,NA,SOUTHWARK,SuperStore,Gu Inspirations Cookies & Cream Desserts 2X85g,1,IN_STORE,3
,,,,,,,,,,,Deli Kitchen 4 Greek Style Flatbreads 320G,2,IN_STORE,1.35
,,,,,,,,,,,Highland Spring Sparkling Mineral Water 1.5Lt,3,IN_STORE,0.85
,,,,,,,,,,,Sunpat Peanut Butter Smooth 400G,1,IN_STORE,2.5
,,,,,,,,,,,Tesco Asparagus Tips 100G,1,IN_STORE,1.8
,,,,,,,,,,,Sunpat Peanut Butter Crunchy 400G,1,IN_STORE,2.5
,,,,,,,,,,,Highland Spring Sparkling Water 6 X 1L,2,IN_STORE,3
,,,,,,,,,,,Fresh & Naked Just Wild Rocket 60G,1,IN_STORE,0.85
,,,,,,,,,,,Tesco Radish Pack 240G,1,IN_STORE,0.43
,,,,,,,,,,,Nescafe Azera Americano Instant Coffee 100G,1,IN_STORE,5.49
,,,,,,,,,,,Tesco British Chicken Thighs 1Kg,1,IN_STORE,2
,,,,,,,,,,,Method Anti-Bacterial Orange Yuzu 828Ml,1,IN_STORE,3
,,,,,,,,,,,Tesco Blueberries 150G,2,IN_STORE,2
,,,,,,,,,,,Tesco Family Salad 250G +33% Extra Free,1,IN_STORE,1.25
,,,,,,,,,,,Tesco Chewy Banana 300G,1,IN_STORE,3.3
,,,,,,,,,,,Tesco Portobello Flat Mushrooms 150G,1,IN_STORE,1
,,,,,,,,,,,Tesco Pork Ribs 700G,1,IN_STORE,4.2
,,,,,,,,,,,T.Ripe & Ready Twin Pack Avocados,1,IN_STORE,1.5
,,,,,,,,,,,Tesco Galia Melon Each Class 1,1,IN_STORE,1.8
,,,,,,,,,,,Buckwud Organic Maple Syrup 250G,1,IN_STORE,4.38
,,,,,,,,,,,Perfectly Imperfect Apples 800G,1,IN_STORE,0.64
,,,,,,,,,,,Nivea Men Black & White Power Antiperspirant Deodo...,1,IN_STORE,1.6
,,,,,,,,,,,Tesco Red Cabbage Each,1,IN_STORE,0.45
,,,,,,,,,,,Tesco Flaked Almonds 100G,1,IN_STORE,1.5
,,,,,,,,,,,Lavazza A Modo Mio Passionale Coffee 16 Capsules,1,IN_STORE,4.4
,,,,,,,,,,,Tesco Carrots 1Kg,1,IN_STORE,0.4
,,,,,,,,,,,Tesco Meaty Strips Rich In Beef 200G,1,IN_STORE,0.8
,,,,,,,,,,,Suntrail Farms Ripen At Home Nectarine M/Mum4,1,IN_STORE,0.95
,,,,,,,,,,,Total Greek Strained Yogurt 500G,1,IN_STORE,2.75
,,,,,,,,,,,Ecover Softener Apple Blossom & Almond 50W 1.5L,1,IN_STORE,4
,,,,,,,,,,,Hoads Farm Free Range Eggs Medium Box Of 6,1,IN_STORE,1.7
,,,,,,,,,,,Tesco Sweet & Crunchy Salad 250G,1,IN_STORE,0.79
,,,,,,,,,,,T.Kent Baby Plum Tomatoes 325G,2,IN_STORE,1
,,,,,,,,,,,Good Boy Wagtastic Cuddle Friends,1,IN_STORE,5
,,,,,,,,,,,Tesco 10 Tripe Sticks Dog Treats 60G,1,IN_STORE,1
,,,,,,,,,,,Tesco Mango 200G,1,IN_STORE,3
,,,,,,,,,,,Nivea For Men Aqua Cool Antiperspirant Deodorant 2...,1,IN_STORE,1.6
8.55,IN_STORE,NA,3189,NA,8.55,54:33.3,8.55,NA,SOUTHWARK,SuperStore,Highland Spring Sparkling Mineral Water 1.5Lt,3,IN_STORE,0.85
,,,,,,,,,,,Tesco Non-Scratch Sponge Pan Cleaners 6 Pack,1,IN_STORE,1
,,,,,,,,,,,Good Boy Wagtastic Cuddle Friends,1,IN_STORE,5
21.05,IN_STORE,0.43,3189,NA,20.62,48:50.4,20.62,NA,SOUTHWARK,SuperStore,Pedigree Puppy Tasty Bites Chicken 125G,1,IN_STORE,1
,,,,,,,,,,,Yamas Authentic Greek Feta Cheese 200G,1,IN_STORE,1.2
,,,,,,,,,,,Tesco Grated Parmigiano Reggiano 100G,1,IN_STORE,2.2
,,,,,,,,,,,Green Giant No Added Salt Sweet Corn 198G,1,IN_STORE,0.75
,,,,,,,,,,,Galbani Italian Burrata Cheese 150G,1,IN_STORE,2.5
,,,,,,,,,,,Cirio Smooth Passata 3X200g,1,IN_STORE,1.3
,,,,,,,,,,,Kingfisher Bamboo Shoots In Water 225G,1,IN_STORE,1.1
,,,,,,,,,,,Tesco Tie Top Compostable Caddy Liners 20 Pack 10L,1,IN_STORE,1.6
,,,,,,,,,,,Alberto Balsam Coconut & Lychee Shampoo 350Ml,1,IN_STORE,0.95
,,,,,,,,,,,Rocket Salad 100G,1,IN_STORE,1.25
,,,,,,,,,,,Tesco Finest Oyster Mushroom Cluster 150G,1,IN_STORE,1.5
,,,,,,,,,,,Tesco Pork Ribs 700G,1,IN_STORE,4.2
,,,,,,,,,,,Tesco Supersweet Mini Corn On The Cob 875G,1,IN_STORE,1.5
49.66,IN_STORE,NA,3720,NA,49.66,15:22.9,49.66,NA,SOUTHWARK PFS,Petrol,San Pellegrino Sparkling Water 500Ml (New),1,IN_STORE,0.65
,,,,,,,,,,,UNLEADED,1,IN_STORE,1.3
21.67,IN_STORE,NA,3720,NA,21.67,13:17.9,21.67,NA,SOUTHWARK PFS,Petrol,UNLEADED,1,IN_STORE,1.28
47.65,IN_STORE,NA,3720,NA,47.65,37:57.6,47.65,NA,SOUTHWARK PFS,Petrol,UNLEADED,1,IN_STORE,1.27
52.2,IN_STORE,NA,3720,NA,52.2,26:06.1,52.2,NA,SOUTHWARK PFS,Petrol,UNLEADED,1,IN_STORE,1.23
38.44,IN_STORE,7.34,3189,NA,31.1,12:50.1,31.1,NA,SOUTHWARK,SuperStore,Tesco Watermelon Wedges 550G,1,IN_STORE,2.5
,,,,,,,,,,,Pot Noodle Chicken & Mushroom 94G +25% Extra Free,1,IN_STORE,0.75
,,,,,,,,,,,Gu Lemon Cheesecake 2X90g,1,IN_STORE,3
,,,,,,,,,,,Light & Free Skyr Strawberry 150G,1,IN_STORE,1
,,,,,,,,,,,Califia Farms Oat Barista Blend 1Ltr,1,IN_STORE,2
,,,,,,,,,,,Graze Bbq Crunch 104G,1,IN_STORE,2.99
,,,,,,,,,,,Philadelphia Original Family Pack 340G,1,IN_STORE,3
,,,,,,,,,,,Arla Skyr Strawberry 150G,1,IN_STORE,1
,,,,,,,,,,,Pot Noodle Sticky Rib 90G,1,IN_STORE,0.75
,,,,,,,,,,,Tesco Beef Rump Steak 255G,3,IN_STORE,3.55
,,,,,,,,,,,Pot Noodle Chinese Chow Mein 90G,1,IN_STORE,0.75
,,,,,,,,,,,T.Kent Baby Plum Tomatoes 325G,1,IN_STORE,1
,,,,,,,,,,,Light & Free Skyr Raspberry Yogurt 150G,1,IN_STORE,1
,,,,,,,,,,,Batchelors Super Noodles Mild Curry 90G,1,IN_STORE,0.6
,,,,,,,,,,,Tesco Finest Oyster Mushroom Cluster 150G,1,IN_STORE,1.5
,,,,,,,,,,,Gu Salted Caramel Cheesecake 2X92g,1,IN_STORE,3
,,,,,,,,,,,Arla Skyr Nordic Sour Cherry 150G,1,IN_STORE,1
,,,,,,,,,,,Nongshim Instant Shin Cup Noodle Soup 68G,1,IN_STORE,0.95
,,,,,,,,,,,Tesco Wild Rocket 60G,1,IN_STORE,1
35.22,IN_STORE,6.48,3189,NA,28.74,53:37.7,28.74,NA,SOUTHWARK,SuperStore,Tesco Sweet Peppers 500G,1,IN_STORE,1.35
,,,,,,,,,,,Tesco 6 Mini Garlic & Coriander Naans,1,IN_STORE,0.89
,,,,,,,,,,,Tesco Prosciutto Crudo & Salami Platter 120G,1,IN_STORE,2.5
,,,,,,,,,,,Tesco Finest Oyster Mushroom Cluster 150G,2,IN_STORE,1.5
,,,,,,,,,,,Kettle Chips Sea Salt & Rosemary 150G,1,IN_STORE,1.99
,,,,,,,,,,,Tesco Folding Camping Chair Grey/Green,2,IN_STORE,8
,,,,,,,,,,,Kettle Chips Seaside Salt & Malt Vinegar 150G,1,IN_STORE,1.99
,,,,,,,,,,,The Ice Co. Ice Cubes 2Kg,1,IN_STORE,1
,,,,,,,,,,,Tesco 4 X Bags Instant Light Lumpwood Charcoal,1,IN_STORE,6.5
13.45,IN_STORE,NA,3189,NA,13.45,17:10.2,13.45,NA,SOUTHWARK,SuperStore,Tesco Honey Roast Salmon Flakes 80G,1,IN_STORE,2.25
,,,,,,,,,,,Tesco Bunched Spring Onions 100G,1,IN_STORE,0.37
,,,,,,,,,,,Tesco Nightingale Farm Peppers,1,IN_STORE,0.86
,,,,,,,,,,,Thai Dragon Sriracha Hot Chilli Sauce 455Ml,1,IN_STORE,1.99
,,,,,,,,,,,Birds Eye 2 Hot And Spicy Chicken 200G,1,IN_STORE,1.65
,,,,,,,,,,,Tesco Smoked Mackerel/Crushed Peppercorn,1,IN_STORE,2.83
,,,,,,,,,,,Arla Skyr Vanilla Yogurt 450G,1,IN_STORE,1.25
,,,,,,,,,,,Tesco Sweet Chilli Salmon Flakes 80G,1,IN_STORE,2.25
42.04,IN_STORE,NA,3720,NA,42.04,16:54.4,42.04,NA,SOUTHWARK PFS,Petrol,UNLEADED,1,IN_STORE,1.2
14.44,IN_STORE,2.46,3189,NA,11.98,59:19.1,11.98,NA,SOUTHWARK,SuperStore,Tesco Bunched Spring Onions 100G,1,IN_STORE,0.37
,,,,,,,,,,,Mccain Home Chips Straight Cut 1Kg,1,IN_STORE,2.29
,,,,,,,,,,,T.Kent Baby Plum Tomatoes 325G,1,IN_STORE,1
,,,,,,,,,,,Tesco Cucumber Whole Each,1,IN_STORE,0.43
,,,,,,,,,,,Tesco Clementine Or Sweet Easy Peeler Pack 600G,1,IN_STORE,1.35
,,,,,,,,,,,Arla Skyr Vanilla Yogurt 450G,1,IN_STORE,1.25
,,,,,,,,,,,Tesco Sussex Romaine Lettuce Hearts 2 Pack,1,IN_STORE,1
,,,,,,,,,,,Tesco Blueberries 150G,2,IN_STORE,2
,,,,,,,,,,,Total Greek Strained Yogurt 500G,1,IN_STORE,2.75
12.55,IN_STORE,0.61,3189,NA,11.94,29:12.4,11.94,NA,SOUTHWARK,SuperStore,Tesco Bunched Spring Onions 100G,1,IN_STORE,0.37
,,,,,,,,,,,Tesco E/Anglian Little Gem Lettuce 2 Pack,1,IN_STORE,0.85
,,,,,,,,,,,Tesco Salmon Fillets 240G,1,IN_STORE,3.25
,,,,,,,,,,,Oatly Oat Drink Semi 1 Litre,1,IN_STORE,1.8
,,,,,,,,,,,Tesco Salad Tomatoes 6 Pack,1,IN_STORE,0.75
,,,,,,,,,,,Schwartz Turmeric 37G,1,IN_STORE,1.6
,,,,,,,,,,,Tesco Organic Whole Cucumber Each,1,IN_STORE,1
,,,,,,,,,,,Califia Farms Xx Espresso Cold Brew Dairy Free Cof...,1,IN_STORE,2.5
,,,,,,,,,,,Tesco Radish Pack 240G,1,IN_STORE,0.43
35.28,IN_STORE,2.45,3189,NA,32.83,39:40.0,32.83,NA,SOUTHWARK,SuperStore,Korean Seaweed Snack 4G,1,IN_STORE,0.7
,,,,,,,,,,,Hoads Farm Free Range Eggs Large Box Of 6,1,IN_STORE,1.95
,,,,,,,,,,,Nivea Men Black & White Power Antiperspirant Deodo...,1,IN_STORE,0.99
,,,,,,,,,,,Tesco Bunched Spring Onions 100G,2,IN_STORE,0.37
,,,,,,,,,,,Tesco Sesame Breadsticks 125G,1,IN_STORE,0.84
,,,,,,,,,,,Gu 2 Apple & Salted Caramel Sponges 2X82g,1,IN_STORE,3
,,,,,,,,,,,Tesco Radish Pack 240G,1,IN_STORE,0.43
,,,,,,,,,,,Boursin Full Fat Soft Cheese Garlic Herb 150G,1,IN_STORE,2
,,,,,,,,,,,Tesco Greek Cheese Feta 200G,1,IN_STORE,1.2
,,,,,,,,,,,Wilkinson Sword Xtreme 3 Razor 4 Plus 2 Free,1,IN_STORE,3.5
,,,,,,,,,,,Arla Skyr Vanilla Yogurt 450G,1,IN_STORE,1.25
,,,,,,,,,,,Haribo Tangfastics 175G,1,IN_STORE,0.79
,,,,,,,,,,,Total Greek Strained Yogurt 500G,1,IN_STORE,2.75
,,,,,,,,,,,Koko Dairy Free Unsweetened Alternative Drink 1 Li...,1,IN_STORE,1.5
,,,,,,,,,,,Tesco 2 Beef Medallion Steaks 340G,1,IN_STORE,2.99
,,,,,,,,,,,Tesco E/Anglian Little Gem Lettuce 2 Pack,1,IN_STORE,0.85
,,,,,,,,,,,Tesco Finest King Oyster Mushrooms 150G,1,IN_STORE,1.6
,,,,,,,,,,,E.Wedel Milk Chocolate With Hazelnuts 100G,1,IN_STORE,1
,,,,,,,,,,,Menissez 2 Sourdough Baguettes 250G,1,IN_STORE,1
,,,,,,,,,,,St Agur Blue Veined Cheese 125G,1,IN_STORE,2.4
,,,,,,,,,,,Napolina Whole Wheat Spaghetti 500G,1,IN_STORE,1.28
,,,,,,,,,,,Princes Tuna Chunks In Brine 145G,1,IN_STORE,1.25
,,,,,,,,,,,Nightingale Farms Cherry Tomatoes 250G,1,IN_STORE,0.48
,,,,,,,,,,,Haribo Starmix 175G,1,IN_STORE,0.79
16,IN_STORE,NA,4270,NA,16,22:50.4,16,NA,DUNFERMLINE PFS,Petrol,UNLEADED,1,IN_STORE,1.23
34.29,IN_STORE,2.25,4425,NA,32.04,17:09.4,32.04,NA,DUNFERMLINE FRE STAON,SuperStore,Kleinkaroo 2 Ostrich Fillet Steaks 250G,1,IN_STORE,5.25
,,,,,,,,,,,Nescafe Dolce Gusto Almond Flat White Coffee Pods ...,1,IN_STORE,3.5
,,,,,,,,,,,Finest Echalion Shallots 400G,1,IN_STORE,1.2
,,,,,,,,,,,Bell's Puff Pastry 425G,1,IN_STORE,1.35
,,,,,,,,,,,Tesco Mozzarella 240G,1,IN_STORE,0.7
,,,,,,,,,,,Cadbury Fair Trade Giant Buttons 175G,1,IN_STORE,1
,,,,,,,,,,,Nescafe Dolce Gusto Starbucks Espresso Roast 12 Ca...,1,IN_STORE,4
,,,,,,,,,,,Highland Game Venison Grill Steaks 300G,1,IN_STORE,2.5
,,,,,,,,,,,Duncan's Family Recipe Oatcakes 200G,1,IN_STORE,1.05
,,,,,,,,,,,T.Kent Baby Plum Tomatoes 325G,1,IN_STORE,1
,,,,,,,,,,,Highland Game Venison Burgers 227G,1,IN_STORE,2.5
,,,,,,,,,,,Filippo Berio Organic Extra Virgin Olive Oil 500Ml,1,IN_STORE,5
,,,,,,,,,,,Scotty Brand Baby Potatoes 750G,1,IN_STORE,1
,,,,,,,,,,,Tesco Pre-Packed Leeks 500G,1,IN_STORE,0.99
,,,,,,,,,,,Tesco Chicken Thigh Fillets 650G,1,IN_STORE,3.25
35.01,IN_STORE,NA,3720,NA,35.01,37:45.2,35.01,NA,SOUTHWARK PFS,Petrol,UNLEADED,1,IN_STORE,1.2
36.54,IN_STORE,4.45,3189,NA,32.09,30:18.8,32.09,NA,SOUTHWARK,SuperStore,Tesco Mixed Sized Organic Eggs 6 Pack,1,IN_STORE,1.8
,,,,,,,,,,,Tesco Stonebaked Pepperoni Pizza 280G,1,IN_STORE,3.5
,,,,,,,,,,,Doritos Stax Sour Cream & Onion Tortilla Chips 170...,1,IN_STORE,2.5
,,,,,,,,,,,Highland Spring Sparkling Water 6 X 1L,4,IN_STORE,3
,,,,,,,,,,,Tesco Finest Salami Milano 70G,1,IN_STORE,2.35
,,,,,,,,,,,Doritos Stax Ultimate Cheese Tortilla Chips 170G,1,IN_STORE,2.5
,,,,,,,,,,,Domestos Original Bleach 2L,1,IN_STORE,2
,,,,,,,,,,,Warburtons Malted Grain & Seeds Bread 400G,1,IN_STORE,1.5
,,,,,,,,,,,President Grated Emmental 200G,1,IN_STORE,2.3
,,,,,,,,,,,Tesco Finest Prosciutto Cotto With Herbs 100G,1,IN_STORE,2.35
,,,,,,,,,,,Tesco Sweet & Crunchy Salad 250G,1,IN_STORE,0.79
,,,,,,,,,,,Tesco Garlic & Rosemary All Butter Flatbread 215G,1,IN_STORE,1.6
,,,,,,,,,,,Tesco Homestyle Straight Cut Oven Chips 950G,1,IN_STORE,1.35
21.92,IN_STORE,2.17,3189,NA,19.75,36:21.4,19.75,NA,SOUTHWARK,SuperStore,Tesco Finest Greek Yogurt 500G,1,IN_STORE,1.75
,,,,,,,,,,,Tesco Bunched Spring Onions 100G,1,IN_STORE,0.37
,,,,,,,,,,,Nivea Men Black & White Power Antiperspirant Deodo...,1,IN_STORE,1.6
,,,,,,,,,,,Tesco Ripe Bananas 5 Pack,1,IN_STORE,0.69
,,,,,,,,,,,Tesco 4 Baking Potatoes,1,IN_STORE,0.41
,,,,,,,,,,,Tesco Salad Tomatoes 6 Pack,1,IN_STORE,0.75
,,,,,,,,,,,Tesco Tzatziki 170G,2,IN_STORE,1.1
,,,,,,,,,,,Tesco Carrots 1Kg,1,IN_STORE,0.4
,,,,,,,,,,,Tesco Radish Pack 240G,1,IN_STORE,0.43
,,,,,,,,,,,Felix Crispies Salmon & Trout 45G,1,IN_STORE,0.89
,,,,,,,,,,,Doritos Stax Ultimate Cheese Tortilla Chips 170G,1,IN_STORE,2.5
,,,,,,,,,,,Tesco Pork Shoulder Steaks 700G,1,IN_STORE,3.5
,,,,,,,,,,,Cadbury Mini Eggs Bag 80G,3,IN_STORE,1
,,,,,,,,,,,Dreamies Cat Treats With Beef 60G,1,IN_STORE,1
,,,,,,,,,,,Tesco Orange Minimum 5 Pack,1,IN_STORE,1.5
,,,,,,,,,,,Tesco Cucumber Whole Each,1,IN_STORE,0.43
,,,,,,,,,,,Tesco Whole Milk 568Ml/1 Pint,1,IN_STORE,0.5
15.91,IN_STORE,2.17,3189,NA,13.74,31:36.7,13.74,NA,SOUTHWARK,SuperStore,Tesco Finest Ground Beef Mince 440G,1,IN_STORE,4
,,,,,,,,,,,Tesco 4 Baking Potatoes,1,IN_STORE,0.41
,,,,,,,,,,,Tesco Finest King Oyster Mushrooms 150G,1,IN_STORE,1.6
,,,,,,,,,,,S.Pellegrino Sparkling Water 6 X 1 Litre,1,IN_STORE,5.5
,,,,,,,,,,,Philadelphia Original Family Pack 340G,1,IN_STORE,3
,,,,,,,,,,,Happy Egg Co Medium Free Range Eggs 6 Pack,1,IN_STORE,1.4
4.95,IN_STORE,0.5,3189,NA,4.45,14:03.4,4.45,NA,SOUTHWARK,SuperStore,Tesco Bunched Spring Onions 100G,1,IN_STORE,0.37
,,,,,,,,,,,Nightingale Farms Baby Plum Tomatoes 250G,1,IN_STORE,0.65
,,,,,,,,,,,Tesco Finest Oyster Mushroom Cluster 150G,1,IN_STORE,1.5
,,,,,,,,,,,Tesco Radish Pack 240G,1,IN_STORE,0.43
,,,,,,,,,,,Birds Eye Field Fresh Petits Pois 545G,1,IN_STORE,2
10,IN_STORE,2,3189,NA,8,22:24.8,8,NA,SOUTHWARK,SuperStore,Tesco Glace Cherry Halves 200G,1,IN_STORE,1.5
,,,,,,,,,,,Tesco Organic Skimmed Milk 1.136L/2 Pints,1,IN_STORE,0.89
,,,,,,,,,,,Gu Lemon Cheesecake 2X90g,1,IN_STORE,3
,,,,,,,,,,,Tesco Cucumber Whole Each,1,IN_STORE,0.43
,,,,,,,,,,,Gu-Zillionaire Cheesecake 2X91.5G,1,IN_STORE,3
,,,,,,,,,,,Tesco Fresh Cut Flat Leaf Parsley 30G,1,IN_STORE,0.7
,,,,,,,,,,,Nightingale Farms Cherry Tomatoes 250G,1,IN_STORE,0.48
11.2,IN_STORE,NA,6070,NA,11.2,02:49.7,11.2,NA,BERMONDSEY PARK EXP,Express,San Miguel 660Ml,1,IN_STORE,1.85
,,,,,,,,,,,Kettle Chips Sea Salt & Balsamic Vinegar 150G,1,IN_STORE,1
,,,,,,,,,,,Jaffa Clementine Or Sweet Easy Peel Pack 600G (C),1,IN_STORE,2.3
,,,,,,,,,,,Gu-Zillionaire Cheesecake 2X91.5G,1,IN_STORE,2.3
,,,,,,,,,,,Tesco Smoked Rindless Back Bacon 300G,1,IN_STORE,1.75
,,,,,,,,,,,Tesco Edam 10 Slice 250G,1,IN_STORE,2
27.62,IN_STORE,3.34,3189,NA,24.28,32:41.5,24.28,NA,SOUTHWARK,SuperStore,Mccain Quick Cook French Fries 750G,1,IN_STORE,2.5
,,,,,,,,,,,Tesco Bunched Spring Onions 100G,1,IN_STORE,0.37
,,,,,,,,,,,Deli Kitchen 4 Greek Style Flatbreads 320G,2,IN_STORE,1.35
,,,,,,,,,,,Hoads Farm Free Range Eggs Large Box Of 6,1,IN_STORE,1.95
,,,,,,,,,,,Tesco Bananas Loose,1,IN_STORE,0.73
,,,,,,,,,,,Loose Red Onions Class 2,1,IN_STORE,1
,,,,,,,,,,,Tesco Salad Tomatoes 6 Pack,1,IN_STORE,0.75
,,,,,,,,,,,Tesco German Salami 135G,2,IN_STORE,1
,,,,,,,,,,,San Pellegrino Sparkling Water 1L,1,IN_STORE,1.35
,,,,,,,,,,,Tesco Aubergine Each,2,IN_STORE,0.77
,,,,,,,,,,,Warburtons White Bistro Brioche Bun 4 Pack,1,IN_STORE,1.4
,,,,,,,,,,,Tesco Garlic Flatbread 255G,1,IN_STORE,2
,,,,,,,,,,,Mcvities Dark Chocolate Digestive Twin 2X316g,1,IN_STORE,2.1
,,,,,,,,,,,President Grated Emmental 200G,1,IN_STORE,2.3
,,,,,,,,,,,Tesco Chicken Thigh Fillets 650G,1,IN_STORE,3.2
,,,,,,,,,,,Tesco Sussex Romaine Lettuce Hearts 2 Pack,1,IN_STORE,1
,,,,,,,,,,,Eastman's Cooked Ham 125G,1,IN_STORE,0.86
,,,,,,,,,,,Tesco Nightingale Farm Peppers,1,IN_STORE,0.79
17.4,IN_STORE,1.95,3189,NA,15.45,37:04.8,15.45,NA,SOUTHWARK,SuperStore,Tesco Smashed Avocado With Lime - 200G,1,IN_STORE,2
,,,,,,,,,,,Highland Spring Sparkling Water 6 X 1L,1,IN_STORE,3
,,,,,,,,,,,President Grated Emmental 200G,1,IN_STORE,2.3
,,,,,,,,,,,Jaffa Clementine Or Sweet Easy Peeler 600G,1,IN_STORE,2
,,,,,,,,,,,Tesco Finest Sweet Mini Peppers 220G,1,IN_STORE,1.5
,,,,,,,,,,,Tesco Clementine Or Sweet Easy Peeler Pack 600G,1,IN_STORE,1.35
,,,,,,,,,,,Tesco Garlic & Rosemary All Butter Flatbread 215G,1,IN_STORE,1.6
,,,,,,,,,,,Tesco Finest 14 Month Parma Ham 78G,1,IN_STORE,2.65
